,Datetime,Text,Retweets,Username,Geolocation
109,2019-03-28 14:00:06+00:00,The manner in which two prominent Bristolians have behaved recently in relation to the reworded Colston statue plaque make me (despite the fact I am not a Bristolian myself) distinctly nauseous. You can read the story so far here: https://www.brh.org.uk/site/articles/the-edward-colston-corrective-plaque/,0,RobinWhitlock66,
110,2019-03-26 16:44:49+00:00,100 human figures placed in front of Colston statue in city centre https://www.bristolpost.co.uk/news/bristol-news/100-human-figures-placed-front-2122990?utm_source=twitter.com&amp;utm_medium=social&amp;utm_campaign=sharebar,0,eddiesurfs,
111,2019-03-26 14:58:41+00:00,Colston statue row continues … #BristolLawHistory,0,gcseabourne,
112,2019-03-25 12:58:09+00:00,Second Colston statue plaque not axed and will still happen but mayor steps in to order a re-write http://dlvr.it/R1VqDc #bristolnews #bristol,0,BristolBizz,
113,2019-03-25 12:48:37+00:00,"The proposal for a second plaque for the statue of Edward Colston has NOT been 'axed' or 'scrapped', and WILL happen, @BristolCouncil have confirmed. (Just not the plaque that the Merchant Venturers want, that's all) #Bristol @CounterColston",4,TristanCorkPost,
114,2019-03-25 10:45:54+00:00,"Brilliant article here from Roger Ball of @BrisRadHis on the #EdwardColston statue PLAQUE WARS that exposes the bigotry, racism &amp; exploitative history of both Colston &amp; the Society of Merchant Venturers in #Bristol. Do read it - https://www.brh.org.uk/site/articles/the-edward-colston-corrective-plaque/",11,Alt_Bristol_,
115,2019-03-25 10:11:42+00:00,I have set up a consultation prior to the consultation about the consultation of the Colston statue plaque wording consultation.,6,marvins_beard,
116,2019-03-25 09:16:58+00:00,Slaver Colston's statue should be removed to a museum where the source of his wealth and his philanthropic bigotry can be properly explained without Merchant Venturer interference ,1,wood5y,
117,2019-03-25 09:13:57+00:00,Local councillor on the Colston statue #futurecity19.,0,FestivalofIdeas,
118,2019-03-25 09:01:45+00:00,"This statue is in my ward, it currently tells a one sided version of history, new plaque is solely an exercise in correction &amp; balance, it should be written by historians not soc merchant venturers Row over plaque to Bristol slave trader Edward Colston https://www.bbc.com/news/uk-england-bristol-47670756",14,bristolpaul,
119,2019-03-24 19:27:56+00:00,"EXC 1/2: @MarvinJRees scraps plaque (after months of wrangling) meant for Colston statue to highlight his role in the slave trade. Merchant Venturers, who had been working on the wording call the decision “baffling”. Exactly what the plaque says has changed several times....... ",9,SimsonPete,
120,2019-03-24 09:48:13+00:00,PLAQUE ATTACKED: https://thebristolian.net/2019/03/22/plaque-attacked/ &lt;&lt;the council hired historian Dr Madge Dresser to work with young people to produce a second 'corrective' plaque for the Colston statue ,1,bristol_citizen,
121,2019-03-22 18:20:13+00:00,"PLAQUE ATTACKED: https://thebristolian.net/2019/03/22/plaque-attacked/ &lt;&lt;Efforts to add a so-called ‘corrective plaque’ to Edward Colston’s statue on the Centre have descended into farce thanks to INTERFERENCE from our local bat shit crazy rich mans’ club, the SOCIETY OF MERCHANT VENTURERS ",3,bristol_citizen,
122,2019-03-07 15:27:46+00:00,Depiction of modern slavery around the statue of Edward Colston in Bristol. Four photos. https://www.instagram.com/p/Butkyx5nd41/?utm_source=ig_twitter_share&amp;igshid=1pendp1cigp1c,0,panistroglodyte,
123,2019-03-04 15:00:11+00:00,"...thought for now illustrates how hard it can be to get right. In Bristol there has been a debate about Edward Colston and his name being used for a performance hall, Schools, roads and so on. Also, should his statue still stand in the city centre? Vital to think this through.",0,julian_selman,
124,2019-02-24 13:10:03+00:00,"The founder of MANDEM, Elias Williams takes a look at identity politics, the #thebestmencanget #GilleteAd and Bristol's controversial Edward Colston statue ",0,TheBristolCable,
125,2019-02-21 11:39:40+00:00,Edward #Colston statue in Bristol. A man whose influence was built on the backs on enslaved ppls. His commemoration here shares similarities with #Cornwallis &amp; #Macdonald in #Canada #cdnhist #phantoms19,1,tpcanoe,
126,2019-02-21 11:31:34+00:00,"Colston statue transformed by guerrilla art, new layers of meaning, memory #Phantoms19 @OlivetteOtele @walknowlive @CounterColston @HuronResearch @huronatwestern",1,ninareidm,
127,2019-02-16 18:18:01+00:00,"There is an uproar regarding this, however Colston’s Statue in Bristol is constantly under protest and one of Margaret Thatcher was almost not erected due to fears of vandals. The radical left need to make up their minds. ",1,ZebraUK_,
128,2019-02-15 12:00:32+00:00,"This school in Bristol has decided to rename on if it's houses to shirk-off its slave-based past. Should the statue of Edward Colston in Bristol also be removed? Labour's @ThangamMP thinks so, while Conservative @ClaireHiscott disagrees",0,NEBeep,
129,2019-02-13 17:36:43+00:00,"At the feet of the Colston statue in #Bristol an artist lays out some representations of modern day slavery: nail salon workers, farm workers etc.",1,brianscoyle,
130,2019-02-12 08:58:09+00:00,I’d not seen this before. At the base of slave trader Colston’s statue ,12,crookedfootball,
131,2019-02-10 11:30:41+00:00,Does anyone know what's happening with the proposed new plaque on the Colston statue? (This may be a tip),0,bristol_citizen,
132,2019-02-06 17:14:23+00:00,Does anyone know who did the intervention around #Colston statue in Bristol? @WeirdBristol @BristolWeird @Boyle123G @bristolarchives @MansonMike,0,RuthHecht,
133,2019-02-06 09:02:55+00:00,"In Bristol, we send our love to the #Stansted15 awaiting sentencing today. We gather next to the statue of slave-trader Colston to oppose the British government's racist policies; from slavery to the hostile environment. @EDeportations @lgsmigrants",16,BrisRisingTide,
134,2019-02-06 07:00:10+00:00,"This morning at 8am this is happening - BRISTOL #STANSTED15 SENTENCING SOLIDARITY! Wear something pink. Meet at the statue of Edward Colston, Bristol’s most celebrates slave trader. More info in link below: http://ow.ly/uiQE30nB1K8 #peacefulprotest",1,AidBoxCommunity,
135,2019-02-04 09:34:49+00:00,Bristol solidarity with the #Stansted15 facing sentencing this Wednesday. 8am by the statue of Edward Colston near the fountains. https://www.facebook.com/events/561150621070372/ #EndDeportations,6,BrisRisingTide,
136,2019-01-24 16:57:09+00:00,There's a text collage panel in Triangular Trade that contrasts the failed online crowdfunding of Bristol's slavery monument with the failed pre-internet crowdfunding of the Colston statue.,0,Seth_Cooke,
137,2019-01-17 23:35:56+00:00,Thinking how interesting conflations between the living and the dead always recur within depictions of slavery: 100 human figures placed in front of Colston statue in city centre https://www.bristolpost.co.uk/news/bristol-news/100-human-figures-placed-front-2122990?utm_source=twitter.com&amp;utm_medium=social&amp;utm_campaign=sharebar,0,ngbodies,
138,2019-01-15 08:33:16+00:00,"Powerful installation of 100 human figures at Colston statue links Bristol's dark past with modern slavery: Nail bar worker. Sex worker. Car wash attendant. Domestic servant. Fruit picker. Kitchen worker. Farm worker. ""It's happening here and now."" ",4,lucyctalbot,
139,2019-01-13 13:55:01+00:00,"Bristol: Cathedral (which is tremendous inside), Edmund Burke, Edward Colston, monument to modern slavery around the base of the Colston statue, Exploration Monument, Queen’s Square with… https://www.instagram.com/p/Bsk8CbMALJ5/?utm_source=ig_twitter_share&amp;igshid=liqokxnnwmq2",1,REMewett,
140,2019-01-08 20:28:50+00:00,Bristol's Colston statue is now pointing at modern day slavery. ,6,DoreenPastor1,
141,2019-01-05 12:45:19+00:00,The incredibly powerful and poignant intervention at the Colston Statue in Bristol #contestedheritage @HE_SouthWest @CounterColston @ColonialCountr1 @DavidOlusoga,9,JDaviesHeritage,
