,Datetime,Id,Link,Text,Retweets,Hashtags,Username,Geolocation
0,2020-07-07 11:12:58+00:00,1280459791849213952,https://twitter.com/dw_tracy/status/1280459791849213952,Africans also fought in the Scottish regiments for the Duke of Wellington. This statue in #hydepark #London also commemorates their bravery.,0,#hydepark #London,dw_tracy,
1,2020-07-06 19:11:09+00:00,1280217739957874690,https://twitter.com/Viktor173869/status/1280217739957874690,"Glasgow's Duke of Wellington statue was allowed to keep a traffic cone on his head by the local council because every time they removed it over the last 30 years a new one would appear within days costing them £10,000 a year to remove them.",0,,Viktor173869,
2,2020-07-06 17:05:30+00:00,1280186121343741952,https://twitter.com/LightningVisit/status/1280186121343741952,I went to glorious Glasgow last year and saw the famous Duke of Wellington Statue crowned with a traffic cone. I wrote about my trip and you can also download my free itinerary https://lightningvisit.wixsite.com/lightningvisit/post/48-hours-in-glasgow-doughnuts-taxidermy-and-nerding-out-at-the-women-s-library,0,,LightningVisit,
3,2020-07-06 12:15:48+00:00,1280113214509010944,https://twitter.com/_Pixel_Lily_/status/1280113214509010944,"Google ""Duke of Wellington Statue"" and you get a funny example of a desecrated statue that pleases everyone but the council of #Glasgow",0,#Glasgow,_Pixel_Lily_,
4,2020-07-05 10:40:22+00:00,1279726808989138944,https://twitter.com/mattkmcg/status/1279726808989138944,"Genuine tragedy that we will never know the name and life story of the first cunt to put a traffic cone on top of the Duke of Wellington statue, a true Glasgow icon x",0,,mattkmcg,
5,2020-07-04 20:42:40+00:00,1279515995531628551,https://twitter.com/Grumpenfuehrer/status/1279515995531628551,"A Hitler statue would be very timely. Stick a traffic cone on the head, like the Duke of Wellington gets in Glasgow. The only time it would be remembered is if the cone falls off. I should go clean out the birdbath. New round of fledglings and they're cute but messy.",0,,Grumpenfuehrer,
6,2020-07-03 13:21:47+00:00,1279042658040758274,https://twitter.com/ekvous/status/1279042658040758274,surprised an army of Janey Godley fans and Glasgow Bible followers haven't formed a vigilante group to protect the Duke of Wellington statue yet,1,,ekvous,
7,2020-07-03 13:02:01+00:00,1279037683139051521,https://twitter.com/UnOxProject/status/1279037683139051521,"Is it time to critically engage with the Duke of Wellington statue's colonial legacy? A fifth blog by our very own tour guide Frankie Enticknap, part of a series on status, memory, iconography, and diversifying historical narratives. ",2,,UnOxProject,
8,2020-07-03 10:05:35+00:00,1278993281574154248,https://twitter.com/drippdnswag/status/1278993281574154248,Glasgow’s Duke of Wellington statue… ,0,,drippdnswag,
9,2020-07-03 08:38:06+00:00,1278971266662359042,https://twitter.com/JackdFacts1/status/1278971266662359042,"Glasgow’s Duke of Wellington statue was allowed to keep a traffic cone on his head by the local council because every time they removed it over the last 30 years a new one would appear within days costing them £10,000 a year to remove them. The post Glasgow’s Duke of Wellin…",0,,JackdFacts1,
10,2020-07-03 08:04:10+00:00,1278962726644088832,https://twitter.com/WORLDSCHOOL6/status/1278962726644088832,"TIL: Glasgow's Duke of Wellington statue was allowed to keep a traffic cone on his head by the local council because every time they removed it over the last 30 years a new one would appear within days costing them £10,000 a year to remove them. Read mo… ",0,,WORLDSCHOOL6,
11,2020-07-03 04:37:25+00:00,1278910695522709504,https://twitter.com/BrettYoud/status/1278910695522709504,"When are you changing Wellington to something else? ""Glasgow's iconic Duke of Wellington statue could potentially be consigned to a ""statue graveyard"", an anti-racist group has proposed.""",0,,BrettYoud,
12,2020-07-03 01:30:05+00:00,1278863552951058434,https://twitter.com/reddit_top/status/1278863552951058434,TIL: Glasgow's Duke of Wellington statue was allowed to keep a traffic cone on his head by the local council because every tim http://hez.us/421vjh,0,,reddit_top,
13,2020-07-03 00:32:29+00:00,1278849055343480834,https://twitter.com/brittlestar/status/1278849055343480834,"This week, someone removed the traffic cone from the Duke of Wellington statue in Glasgow. In true Glasgow style, the situation was thoroughly remedied today. - Worked in Glasgow for a year about a block from here. Loved it. ",4,,brittlestar,
14,2020-07-02 23:21:49+00:00,1278831273293856768,https://twitter.com/Glaikitgit/status/1278831273293856768,The duke of Wellington statue with a cone on his head is a bit of an icon in Glasgow We love it!,0,,Glaikitgit,
15,2020-07-02 23:08:54+00:00,1278828022263619585,https://twitter.com/fyrewinter/status/1278828022263619585,i mean they always put a cone on the statue of the duke of wellington so i wouldn't be surprised of a cone toilet,0,,fyrewinter,
16,2020-07-02 21:05:07+00:00,1278796869376921600,https://twitter.com/LearntTodayThat/status/1278796869376921600,"Glasgow's Duke of Wellington statue was allowed to keep a traffic cone on his head by the local council because every time they removed it over the last 30 years a new one would appear within days costing them £10,000 a year to remove them. ",0,,LearntTodayThat,
17,2020-07-02 20:36:49+00:00,1278789748761526273,https://twitter.com/serenewellness/status/1278789748761526273,"TIL: Glasgow's Duke of Wellington statue was allowed to keep a traffic cone on his head by the local council because every time they removed it over the last 30 years a new one would appear within days costing them £10,000 a year to remove them. ",0,,serenewellness,
18,2020-07-02 18:57:07+00:00,1278764658514628609,https://twitter.com/AswadsWorld/status/1278764658514628609,"This is totally unacceptable , where the F**k is the cone #NoConeWellington #GoMA #Glasgow @Equestrian statue of the Duke of Wellington, Glasgow https://www.instagram.com/p/CCJospLhN5hID4xA-g9eda8u-ybXT8faA4dZos0/?igshid=hvm0de0n6dj8",0,#NoConeWellington #GoMA #Glasgow,AswadsWorld,
19,2020-07-02 17:37:18+00:00,1278744570860273665,https://twitter.com/daxmahoney/status/1278744570860273665,it was a symbol of hope to them as they drudged through a difficult period in their lives. Why Glasgow's Duke of Wellington statue was allowed to keep his cone https://inews.co.uk/inews-lifestyle/travel/glasgows-duke-wellington-statue-allowed-keep-cone-53146?ito=twitter_share_article-top,0,,daxmahoney,
20,2020-07-02 16:49:22+00:00,1278732507270320133,https://twitter.com/LoraineDebry/status/1278732507270320133,"TIL: Glasgow's Duke of Wellington statue was allowed to keep a traffic cone on his head by the local council because every time they removed it over the last 30 years a new one would appear within days costing them £10,000 a year to remove them. - https://ift.tt/2ZvGDDJ #til #…",0,#til,LoraineDebry,
21,2020-07-02 15:02:09+00:00,1278705527502057472,https://twitter.com/_iBot7/status/1278705527502057472,"Glasgow's Duke of Wellington statue was allowed to keep a traffic cone on his head by the local council because every time they removed it over the last 30 years a new one would appear within days costing them £10,00... http://www.reddit.com/r/todayilearned/comments/hjv124/til_glasgows_duke_of_wellington_statue_was/",0,,_iBot7,
22,2020-07-02 14:37:22+00:00,1278699289745731589,https://twitter.com/annmsutton/status/1278699289745731589,"Why Glasgow's Duke of Wellington statue was allowed to keep his cone https://inews.co.uk/inews-lifestyle/travel/glasgows-duke-wellington-statue-allowed-keep-cone-53146?ito=twitter_share_article-top And in Houston, graffiti over a freeway. We all have our thing.",0,,annmsutton,
23,2020-07-02 14:26:22+00:00,1278696523103186949,https://twitter.com/MichaelSpecks/status/1278696523103186949,"TIL: Glasgow's Duke of Wellington statue was allowed to keep a traffic cone on his head by the local council because every time they removed it over the last 30 years a new one would appear within days costing them £10,000 a year to remove them. ",1,,MichaelSpecks,
24,2020-07-02 13:45:32+00:00,1278686247712505856,https://twitter.com/TILbyqwyck/status/1278686247712505856,"TIL: Glasgow's Duke of Wellington statue was allowed to keep a traffic cone on his head by the local council because every time they removed it over the last 30 years a new one would appear within days costing them £10,000 a year to remove them. https://inews.co.uk/inews-lifestyle/travel/glasgows-duke-wellington-statue-allowed-keep-cone-53146?utm_source=dlvr.it&amp;utm_medium=twitter",0,,TILbyqwyck,
25,2020-07-02 13:34:17+00:00,1278683415840260097,https://twitter.com/Jonnyyy203/status/1278683415840260097,The thing that makes me most proud of being Glaswegian is the ongoing civil war wae the council aboot the cone/hat on the Duke of Wellington statue. We will not yield!,1,,Jonnyyy203,
26,2020-07-02 11:37:15+00:00,1278653961512386560,https://twitter.com/Kingxjamez2/status/1278653961512386560,The duke of Wellington and his cones are going nowhere!.The king has spoken.I'll get ma da to guard that statue!,0,,Kingxjamez2,
27,2020-07-02 11:14:42+00:00,1278648287290183680,https://twitter.com/RepeatBeatPoet/status/1278648287290183680,The only statue in the UK I’m a fan of is the constantly cone-hatted Duke Of Wellington in Glasgow ,0,,RepeatBeatPoet,
28,2020-07-02 10:03:26+00:00,1278630351661867009,https://twitter.com/Mark1957/status/1278630351661867009,Now here's a sight you don't see every day - Glasgow's famous Duke of Wellington statue without a traffic cone on his head. https://action4equalityscotland.blogspot.com/2020/07/glasgow-and-duke.html,1,,Mark1957,
29,2020-07-02 09:54:32+00:00,1278628112234881024,https://twitter.com/MotherwellWhit1/status/1278628112234881024,Yesterday someone removed the cone from the Duke of Wellington statue.... today Glasgow responded #glasgow #StatueDefenders #Scotland,0,#glasgow #StatueDefenders #Scotland,MotherwellWhit1,
30,2020-07-02 06:29:29+00:00,1278576509180092416,https://twitter.com/80_mcswan/status/1278576509180092416,"For some unknown reason someone took down the traffic cone yesterday of The Duke of Wellington Statue, usually seen with a cone placed on its head, is a popular landmark in Glasgow Glasgow has responded like only Glasgow can! ",50,,80_mcswan,
