Datetime,ID,Score,Link,Text,Username,Retweets,Hashtags,Geolocation
2019-07-08,1148059516853874688,0.058823529411764705,https://twitter.com/GrayConnolly/status/1148059516853874688,george washington immensely respected duke wellington great admirer statue lincoln near westminster late tory father thought fdr great man alanbrooke thought macarthurthe best general ww2,GrayConnolly,0,,
2019-07-02,1146138921237196802,0.0,https://twitter.com/MichaelBarnet18/status/1146138921237196802,people say duke wellington statue demeaned cone moved…,MichaelBarnet18,0,,
2019-07-02,1146018151454400513,0.0,https://twitter.com/ScotRail/status/1146018151454400513,classic wait mean oor wullie coordinating duke wellington statue ^carrie,ScotRail,0,,
2019-07-01,1145591090772418560,0.030303030303030304,https://twitter.com/youngbuckeen/status/1145591090772418560,19th century cringe spectacular level napoleon huge heroic nude statue mars peacemaker helpfully located duke wellingtonhouse london,youngbuckeen,0,,
2019-06-30,1145446208946790400,-0.0070921985815602835,https://twitter.com/templar_forum/status/1145446208946790400,strange tradition glasgow scotland statue duke wellington permanently crowned traffic cones city council may given removing history glasgowcc,templar_forum,1,,
2019-06-30,1145390793705889792,0.022727272727272728,https://twitter.com/HighSpiritsTour/status/1145390793705889792,oor wullie joining fun glasgow oorwullie glasgow glasgowgalleryofmodernart dukeofwellingtonglasgow dukeofwellingtoncone glasgowhumour glasgowarchitecture duke wellington statue,HighSpiritsTour,0,,
2019-06-28,1144743585398558720,0.047619047619047616,https://twitter.com/BigLinton/status/1144743585398558720,re-done duke wellington statue amp entered city theme comp thing week better get top,BigLinton,0,,
2019-06-27,1144343750774329345,0.015151515151515152,https://twitter.com/sam_crowley/status/1144343750774329345,statue 1st duke wellington know guy beat napoleon waterloo yes traffic cone head horsehead yes ittradition gallery modern art behind,sam_crowley,0,,
2019-06-26,1143833146154246146,-0.03614457831325301,https://twitter.com/lynnharrisx/status/1143833146154246146,dunno scandalous today minute taking cone duke wellington statue cascasg gbxanthems,lynnharrisx,1,,
2019-06-25,1143472785823608833,0.013157894736842105,https://twitter.com/DiscoverHx/status/1143472785823608833,check duke wellington regiment statue right halifax marking 304 years service statue grand feet tall created sculptor andrew sinclair leave town seeing…,DiscoverHx,1,,
2019-06-24,1143252797195862016,0.0,https://twitter.com/kate_duncan/status/1143252797195862016,fixed cledwell_iisd million people live mexico city one student put traffic cone statue ref duke wellington glasgow,kate_duncan,0,,
2019-06-23,1142787757724618752,0.0,https://twitter.com/ScavengerEthic/status/1142787757724618752,itonly confusing try understand anything statue past duke wellington nobody glasgow cares thatwho even current duke wellington whatever anachronistic reason,ScavengerEthic,0,,
2019-06-22,1142486989373132800,0.0,https://twitter.com/BunnyKrusher/status/1142486989373132800,edinburgh duke wellington statue traffic cone head bird,BunnyKrusher,0,,
2019-06-20,1141628984012214272,0.0,https://twitter.com/scotyoung1981/status/1141628984012214272,posted photo duke wellington statue,scotyoung1981,0,,
2019-06-19,1141479343337672704,0.015267175572519083,https://twitter.com/SundayTimesScot/status/1141479343337672704,9th duke wellington spoken sense bemusement placing traffic cone glasgow statue famous predecessor become international symbol city,SundayTimesScot,0,,
2019-06-19,1141414091120087044,0.0,https://twitter.com/cath_50/status/1141414091120087044,video swarm bees descend duke wellington statue edinburgh city centre,cath_50,0,,
2019-06-19,1141408137351766017,0.0,https://twitter.com/Scotland4me/status/1141408137351766017,video swarm bees descend duke wellington statue edinburgh city centre,Scotland4me,0,,
2019-06-19,1141404648621916162,0.0,https://twitter.com/KnittedLibrary/status/1141404648621916162,rounded mini tour glasgow visit statue duke wellington nicknamed coneheid eblip10,KnittedLibrary,0,,
2019-06-19,1141384670925467649,0.0,https://twitter.com/RandBHoney/status/1141384670925467649,video swarm bees descend duke wellington statue edinburgh city centre,RandBHoney,0,,
2019-06-19,1141370316649897984,0.0,https://twitter.com/Miss_Elphie/status/1141370316649897984,caught look swarm bees duke wellington statue edinburgh afternoon police beekeeper check coveredinbees eddieizzard,Miss_Elphie,1,,
2019-06-19,1141367452393181184,0.01282051282051282,https://twitter.com/edinburghpaper/status/1141367452393181184,huge swarm bees settled duke wellington statue edinburgh city centre afternoon,edinburghpaper,5,,
2019-06-19,1141341599701590016,0.03763440860215054,https://twitter.com/Impact_Funding/status/1141341599701590016,biased favourite definitely one youngscot beside duke wellington statue created celebrate yoyp2018 proudly support young scot scotgovpromoting equality amp cohesion fund weinvestinchange,Impact_Funding,0,,
2019-06-19,1141325953441959936,0.0,https://twitter.com/skhsusieq/status/1141325953441959936,oorwullie oorwulliebuckettrail glasgow streetart oorwullieglasgow duke wellington statue,skhsusieq,0,,
2019-06-17,1140748021896032257,0.0,https://twitter.com/GestaltungDB/status/1140748021896032257,duke wellington left scratching head glasgowcone head statue,GestaltungDB,0,,
2019-06-17,1140689409282646017,-0.022058823529411766,https://twitter.com/LVAldershot/status/1140689409282646017,today eve battle waterloo took place 18th june 1815 resulted defeat napoleon bonaparte photo equestrian statue duke wellington aldershot,LVAldershot,0,,
2019-06-16,1140311624189980672,0.021739130434782608,https://twitter.com/SundayTimesScot/status/1140311624189980672,9th duke wellington spoken bemusement placing traffic cone glasgow statue famous predecessor,SundayTimesScot,0,,
2019-06-16,1140303043034066951,0.02617801047120419,https://twitter.com/Johnwritlarge/status/1140303043034066951,weekend 22435 28mm soldiers 120 players around world uofglasgow waterlooreplay re-fought waterloo finished allies amused famous cone appearing duke wellington figurine glasgow statue pdunshea,Johnwritlarge,1,,
2019-06-16,1140299785389387781,-0.022222222222222223,https://twitter.com/Daily_Record/status/1140299785389387781,present duke wellington revealed struggled get picture statue without cone book first duke,Daily_Record,4,,
2019-06-16,1140251826656305152,0.0,https://twitter.com/LVAldershot/status/1140251826656305152,somebody left duke wellington statue aldershot photos friday 14th june cathcooper2 rushmoorcouncil,LVAldershot,0,,
2019-06-16,1140177195823960064,0.0,https://twitter.com/SundayTimesScot/status/1140177195823960064,become realise iconic image glasgow think amusing way bizarre another way 9th duke wellington spoken bemusement placing traffic cone glasgow statue famous predecessor echobox=1560672905,SundayTimesScot,5,,
2019-06-16,1140170120616120320,0.015384615384615385,https://twitter.com/SundayTimesSco/status/1140170120616120320,9th duke wellington tells sense bemusement placing traffic cone glasgow statue famous predecessor become international symbol city,SundayTimesSco,0,,
2019-06-15,1139789677056200704,0.03409090909090909,https://twitter.com/LVAldershot/status/1139789677056200704,equestrian statue duke wellington aldershot warm early evening sunshine friday 14th june,LVAldershot,0,,
2019-06-14,1139501307893600256,0.0,https://twitter.com/_smileangel/status/1139501307893600256,imagine seeing duke wellington statue,_smileangel,0,,
2019-06-13,1139254275983515648,-0.030534351145038167,https://twitter.com/stephensh_arp/status/1139254275983515648,honestly wish cunts word stop flinging witever fuck feel like duke wellington statue man boys good cone hat leave fuck alone cheers,stephensh_arp,0,,
2019-06-13,1139201966998003712,0.0,https://twitter.com/DSM888/status/1139201966998003712,spot grove west end edinburgh sir john steell built first sculptural bronze foundry scotland cast duke wellington statues stevenson wallace statue cast thewallacemon⁩,DSM888,2,,
2019-06-13,1139194484581961728,0.017341040462427744,https://twitter.com/AwakenInspire/status/1139194484581961728,great visual pursuit soccersteve found dry spot practice horses really need practice duke wellington statue awakeninspire holbeinart watercolour sketch london riwatercolours,AwakenInspire,1,,
2019-06-12,1138871350272167936,0.06432748538011696,https://twitter.com/Conflict_arch/status/1138871350272167936,really love new memorial duke wellingtonregiment halifax halifaxmilitary history really interesting amp lovely see servicemen amp women years commemorated beautiful statue,Conflict_arch,15,,
2019-06-12,1138831957259902981,0.0,https://twitter.com/soccersteve/status/1138831957259902981,found dry spot practice horses really need practice duke wellington statue awakeninspire holbeinart watercolour sketch london riwatercolours,soccersteve,0,,
2019-06-09,1137808583188537348,0.008928571428571428,https://twitter.com/TAR_AaronClark/status/1137808583188537348,highlands glasgow visited glasgow cathedral george square statue duke wellington road cone really cool shopping…,TAR_AaronClark,0,,
2019-06-09,1137631174019473408,0.0,https://twitter.com/s_nummelin/status/1137631174019473408,kings coneheads glasgow duke wellington statue,s_nummelin,0,,
2019-06-08,1137151261470576641,0.0,https://twitter.com/UKNewsBot1/status/1137151261470576641,glasgowduke wellington statue wearing pink daily record,UKNewsBot1,0,,
2019-06-07,1137063123968548864,0.04201680672268908,https://twitter.com/mrsgeldof/status/1137063123968548864,couldnget photo bus duke wellington statue cone head per pink scotland womenfootball top saltire cape love glasgow swnt,mrsgeldof,5,,
2019-06-07,1137049084131512320,0.0,https://twitter.com/marioprofili/status/1137049084131512320,cappelli certo livello duke wellington statue,marioprofili,0,,
2019-06-07,1137040343759818752,0.017094017094017096,https://twitter.com/SouthsideSNP/status/1137040343759818752,duke wellington statue dressed support scotlandwomen football team attached horse sign saying mon scotland girls game,SouthsideSNP,1,,
2019-06-07,1137016720755953664,0.030303030303030304,https://twitter.com/Glasgow_Times/status/1137016720755953664,duke wellington statue dressed support scotlandwomen football team,Glasgow_Times,13,,
2019-06-07,1136966764498210818,0.06493506493506493,https://twitter.com/Ggma1912/status/1136966764498210818,nice see duke showing support scotland fifawwc glasgow duke wellington statue,Ggma1912,0,,
2019-06-04,1136059852323794945,0.0,https://twitter.com/mamadesilees/status/1136059852323794945,glasgow juin 2019 université glasgow kelvingrove museum scottish breakfast duke wellington statue,mamadesilees,1,,
2019-06-04,1136014302727626755,0.0,https://twitter.com/LVAldershot/status/1136014302727626755,rhododendrons bloom around equestrian statue duke wellington aldershot,LVAldershot,0,,
2019-06-04,1135990879855009792,0.007751937984496124,https://twitter.com/HMSMrNiceGuy/status/1135990879855009792,found one thing makes love miss glasgow much today regards duke wellington statue outside goma aka infamous cone-heided horse man,HMSMrNiceGuy,0,,
2019-06-02,1135095626335739904,0.0,https://twitter.com/ChitkwesuManetu/status/1135095626335739904,glasgow duke wellington statue got traffic cone 1st photo taken yesterday glasgow,ChitkwesuManetu,1,,
2019-06-01,1134869346570985472,0.0,https://twitter.com/LVAldershot/status/1134869346570985472,earlier today equestrian statue duke wellington aldershot,LVAldershot,0,,
2019-05-31,1134569618276802560,0.0,https://twitter.com/DarranScot/status/1134569618276802560,thelastleg glasgow front duke wellington statue matching cones whereshouldwetaketrump,DarranScot,1,,
2019-05-29,1133796342906724353,0.047619047619047616,https://twitter.com/Aonachan25/status/1133796342906724353,bbcgetiton billy connelly wisnae yer wellies celebrate statue duke wellington glasgowmost iconic landmark,Aonachan25,0,,
2019-05-29,1133739974476611589,0.03164556962025317,https://twitter.com/LeeMcGuireArt/status/1133739974476611589,greghemphill96 since retweeted artwork two putting cone duke wellington statue made wee bit money sales think fair offer cast want one free print want one msg,LeeMcGuireArt,0,,
2019-05-28,1133445516262596613,0.041666666666666664,https://twitter.com/thomaswpaton/status/1133445516262596613,glasgow trafficcone ubiquitouspic oldfriends love duke wellington statue,thomaswpaton,0,,
2019-05-28,1133360968577232896,0.0,https://twitter.com/LouiselyCahill/status/1133360968577232896,duke wellington statue glasgow adorned two traffic cones visitscotland peoplemakegla,LouiselyCahill,0,,
2019-05-27,1133103076729073667,0.025974025974025976,https://twitter.com/GaryJamesWriter/status/1133103076729073667,count sporting statue sportingstatues chrisstridefio part memorial duke wellington regt halifax bit pays tribute rugby heritage collinstony may interested,GaryJamesWriter,2,,
2019-05-26,1132740588456108033,0.0,https://twitter.com/LynnieYankee/status/1132740588456108033,imagine went place nailing wee plaques stuff posse stump posse duke wellington statue posse kelvingrove museum,LynnieYankee,0,,
2019-05-26,1132698235729006592,0.0,https://twitter.com/7HillsTour/status/1132698235729006592,duke wellington riding copenhagen favourite horse statue placed princes street 1852 months wellingtondeath even welcomed dukes bitter political opponents defeat napoleon 1815 edinburgh,7HillsTour,5,,
2019-05-26,1132497648668176384,0.0,https://twitter.com/Nobubhoy/status/1132497648668176384,duke wellington statue green white keepthecone,Nobubhoy,12,,
2019-05-25,1132256514692063234,0.0,https://twitter.com/chloe10222/status/1132256514692063234,lewiscapaldi still duke wellington statue,chloe10222,0,,
2019-05-24,1131934957293719552,-0.008547008547008548,https://twitter.com/beccagaga_/status/1131934957293719552,still howling fact michaelbuble posted selfie concert last night duke wellington statue lewiscapaldi face forget cone,beccagaga_,1,,
2019-05-24,1131827781275389953,0.03488372093023256,https://twitter.com/DhAh_Fax/status/1131827781275389953,caught new duke wellington regiment statue early light beautiful blue sky halifax 1dwr,DhAh_Fax,0,,
2019-05-23,1131588886155730945,0.0,https://twitter.com/pfwaus/status/1131588886155730945,statue achilles hyde park london commemoration arthur duke wellington travel history,pfwaus,0,,
2019-05-23,1131549024933371904,-0.011049723756906077,https://twitter.com/AHAllardyce/status/1131549024933371904,today learned glasgow connections battle waterloo traffic cone head statue duke wellington replaying battle uofglasgow 22000 miniature soldiers aid veterans charity digwaterloo read,AHAllardyce,7,,
2019-05-21,1130913701316444160,0.033707865168539325,https://twitter.com/kzaraallanc/status/1130913701316444160,another wee good night around royal exchange square foo time couch duke wellington statue,kzaraallanc,0,,
2019-05-21,1130909327404011521,0.0,https://twitter.com/StewartMcIntyr9/status/1130909327404011521,still bigger achievement seeing face duke wellington statue,StewartMcIntyr9,0,,
2019-05-21,1130885253877440512,0.0,https://twitter.com/LoopyCrown3/status/1130885253877440512,new statue unveiled duke wellingtonregiment itv news via youtube,LoopyCrown3,0,,
2019-05-21,1130860440089763841,0.06481481481481481,https://twitter.com/KirkleesMayor/status/1130860440089763841,friday may 17th 2019 memorable occasion extremely honoured proud represent kirklees halifaxminster beautiful moving service followed unveiling memorial dedicated duke wellington regiment absolutely amazing statue see,KirkleesMayor,3,,
2019-05-21,1130840580596965376,-0.011235955056179775,https://twitter.com/beemcrechill/status/1130840580596965376,love someones changed colour cone duke wellington statue lewis capaldis face still fuckin,beemcrechill,0,,
2019-05-21,1130840334269911045,0.0,https://twitter.com/CubicleEmployee/status/1130840334269911045,always cone duke wellington statue thatalso gta easter egg scottish devs,CubicleEmployee,0,,
2019-05-21,1130836269016256512,0.0,https://twitter.com/perg10/status/1130836269016256512,started glasgow people kept putting cone statue duke wellington every time police removed another would appear gave left,perg10,0,,
2019-05-21,1130795443317817344,0.0,https://twitter.com/eversotrusty/status/1130795443317817344,posted photo duke wellington statue,eversotrusty,0,,
2019-05-21,1130753791933014016,0.007352941176470588,https://twitter.com/poundarts/status/1130753791933014016,thought best way write play perform free play tells story broken heirloom statue duke wellington scriptwriterquandary unfolding disaster,poundarts,1,,
2019-05-20,1130575914776113153,0.0,https://twitter.com/iorverth/status/1130575914776113153,know thattradition scotland especially glasgow statue duke wellington,iorverth,0,,
2019-05-20,1130508573568634887,0.013157894736842105,https://twitter.com/_lyonesse/status/1130508573568634887,statue duke wellington top actually made melted cannons used battle waterloo,_lyonesse,0,,
2019-05-20,1130480248678748160,0.034782608695652174,https://twitter.com/RCBridgestock/status/1130480248678748160,duke wellington regiment statue getting lots interest halifax calderdale today quite rightly magnificent calderdale,RCBridgestock,9,,
2019-05-20,1130458816347287558,0.0,https://twitter.com/MG07872856/status/1130458816347287558,london equestrian statue duke wellington london londra london apple nikon nikonitalia nikond7500 nikonswitzerland nikonphotography nikond750 westminster photography photographer photo…,MG07872856,0,,
2019-05-20,1130426880136556544,0.06944444444444445,https://twitter.com/SleepyBkDragon/status/1130426880136556544,beautiful new statue halifax honour duke wellington west riding regiment,SleepyBkDragon,0,,
2019-05-19,1130253997594546176,0.0,https://twitter.com/Arthurj999/status/1130253997594546176,finally seen duke wellington statue glasgow lewis capaldi mask,Arthurj999,0,,
2019-05-19,1130115205076312065,0.12,https://twitter.com/Gav_The_Bantam/status/1130115205076312065,never expected see elephant halifax brand new statue duke wellington regiment simply beautiful awesome magnificent glorious fine tribute fine band men,Gav_The_Bantam,1,,
2019-05-18,1129822607321305088,0.0,https://twitter.com/Cara_Xx_/status/1129822607321305088,lewiscapaldi duke wellington statue really influenced people glasgow,Cara_Xx_,0,,
2019-05-18,1129752519423516672,0.0,https://twitter.com/MarkHillMBE/status/1129752519423516672,joined dukes 1987 week saw unveiling commemorative statue duke wellington regiment west riding halifax 3376 vfc beinspired,MarkHillMBE,9,,
2019-05-18,1129685547528675329,0.013605442176870748,https://twitter.com/gazontheradio/status/1129685547528675329,fab lewiscapaldi gets duke wellington treatment mask spotted famous statue seen coupon elsewhere around scotland hear music goradiodab live glasgow,gazontheradio,0,,
2019-05-17,1129503145418252289,0.0,https://twitter.com/AE_Warley_Cllr/status/1129503145418252289,thought going refer victoria wood bury megan compete equestrian statue arthur wellesley 1st duke wellington located royal exchange square glasgow,AE_Warley_Cllr,0,,
2019-05-17,1129456979867521024,0.006896551724137931,https://twitter.com/icequeenfairie/status/1129456979867521024,edinburgh attempting glasgow duke wellington statue conehead historystudent history maturestudent scotland visitscotland edinburgh united kingdom,icequeenfairie,0,,
2019-05-17,1129453396359094273,0.03773584905660377,https://twitter.com/PDLawrence1962/status/1129453396359094273,halifax unveiling magnificent statue commemorate 304 years duke wellington regiment west riding thank grace duke wellington mayor calderdale making special day,PDLawrence1962,7,,
2019-05-17,1129447666394341376,0.0,https://twitter.com/AswadsWorld/status/1129447666394341376,duke gone new level hilarity lewiscapaldi duke wellington statue,AswadsWorld,0,,
2019-05-17,1129433296608399360,0.0374331550802139,https://twitter.com/Calderdale/status/1129433296608399360,afternoon duke wellington regiment memorial unveiled woolshops sunny halifax huge crowds gathered see statue first time thank everyone attended fantastic turnout way end week dwr_memorial,Calderdale,31,,
2019-05-17,1129432602803408896,0.038834951456310676,https://twitter.com/HONOUROURFORCES/status/1129432602803408896,today wonderful memorial statue duke wellingtonregiment unveiled halifax west yorkshire honourourforces,HONOUROURFORCES,2,,
2019-05-17,1129432048974880768,-0.04,https://twitter.com/Sonic_Spoilers/status/1129432048974880768,way lewiscapaldi stv news cause someone put face duke wellington statue fucking howling lewiscapaldi,Sonic_Spoilers,0,,
2019-05-17,1129430615370141696,0.01,https://twitter.com/HXCourier/status/1129430615370141696,crowds turn huge numbers see duke wellingtonregimental memorial statue unveilied halifax town centre,HXCourier,2,,
2019-05-17,1129426090282422272,0.02531645569620253,https://twitter.com/bfpix/status/1129426090282422272,editing pictures unveiling duke wellington regimental memorial statue andrew sinclair stunning lookout pictures yorkshirepost hxcourier discoverhx thebeaconhx,bfpix,1,,
2019-05-17,1129425273349447682,0.0,https://twitter.com/sluttyIibra/status/1129425273349447682,lewis capaldis face still duke wellington statue,sluttyIibra,0,,
2019-05-17,1129417533445103616,0.05454545454545454,https://twitter.com/Keitherrs/status/1129417533445103616,whole ordeal duke wellington statue glasgow makes happy,Keitherrs,0,,
2019-05-17,1129411462374547456,0.05384615384615385,https://twitter.com/WYP_JSwaine/status/1129411462374547456,brilliant afternoon wyp_halifax unveiling duke wellington statue lots people attended good spirits teamhalifax communityengagement,WYP_JSwaine,1,,
2019-05-17,1129401780671062016,0.0,https://twitter.com/Nicola_Rees/status/1129401780671062016,dukes forever heart halifax bronze statue sculptor andrew sinclair captures 300+ years duke wellington regiment,Nicola_Rees,2,,
2019-05-17,1129381907391762432,0.0,https://twitter.com/GraystonThe/status/1129381907391762432,way unveiling statue duke wellington regiment,GraystonThe,2,,
2019-05-17,1129364145776861185,0.023622047244094488,https://twitter.com/Nicola_Rees/status/1129364145776861185,bells chime halifax minister duke wellington regiment celebrations new statue unveiled town forever remember dukes bbclooknorth,Nicola_Rees,8,,
2019-05-17,1129359708920393730,0.014492753623188406,https://twitter.com/BankfieldMuseum/status/1129359708920393730,today honoured visit duke wellington curator john gave duke tour regimental museum attended unveiling new commemorative statue halifax dwr,BankfieldMuseum,11,,
2019-05-17,1129353129164722176,0.0,https://twitter.com/HXCourier/status/1129353129164722176,long statue commemorating duke wellingtonregiment halifax town centre unveiled stay tuned courier afternoon latest,HXCourier,0,,
2019-05-17,1129346709677629441,0.04950495049504951,https://twitter.com/SkircoatGDirect/status/1129346709677629441,road closures place duke wellington statue unveiled today top woolshops excited see whatbehind boards,SkircoatGDirect,0,,
2019-05-17,1129338302837010433,0.0,https://twitter.com/MetroTravelNews/status/1129338302837010433,market street halifax closed 1200-1700 duke wellington statue installation buses diverted via horton street square road amp winding road wybus,MetroTravelNews,0,,
2019-05-17,1129321600506109952,0.017964071856287425,https://twitter.com/SGVibrations/status/1129321600506109952,great meetings resonate project partners last month glasgow inow stood cityduke wellington statue apparently july traffic cones head traffic cone-ing going since 1980s,SGVibrations,0,,
2019-05-17,1129319026289762304,0.005,https://twitter.com/CRobertsonUK/status/1129319026289762304,independent scotland duke wellington statue glasgow replaced 20ft traffic cone inch duke wellington top inside feature resplendent thatchers bust pay per pee urinal made former clydeside metal workers,CRobertsonUK,62,,
2019-05-17,1129299285886087168,0.013071895424836602,https://twitter.com/Calderdale/status/1129299285886087168,donmiss unveiling duke wellingtonregimental memorial woolshops halifax 315pm today 18ft statue lasting legacy honouring sacrifice gave lives dwr_memorial,Calderdale,0,,
2019-05-16,1129142991535464448,-0.07407407407407407,https://twitter.com/Caitlyn_Banna/status/1129142991535464448,miss duke wellington statue,Caitlyn_Banna,0,,
2019-05-16,1129114465507708928,0.0,https://twitter.com/Sl8terBoi/status/1129114465507708928,glasgow work seeing lewiscapaldi face duke wellington statue made evening peoplemakeglasgow,Sl8terBoi,0,,
2019-05-16,1129088457568116737,0.0,https://twitter.com/brawday/status/1129088457568116737,glasgowduke wellington statue given lewis capaldi makeover,brawday,0,,
2019-05-16,1129080702287405057,0.026785714285714284,https://twitter.com/Ceri_Broughallx/status/1129080702287405057,love know people managing get things onto duke wellington statue glasgow proper massive real life actual mystery,Ceri_Broughallx,0,,
2019-05-16,1129076690347614208,0.0,https://twitter.com/JoshKingWrites/status/1129076690347614208,lewis capaldi given emoji day face appears duke wellington statue lewiscapaldi,JoshKingWrites,0,,
2019-05-16,1129069900830527488,0.0,https://twitter.com/Scotland4me/status/1129069900830527488,glasgow duke wellington statue given lewis capaldi makeover,Scotland4me,0,,
2019-05-16,1129053755591340032,0.023529411764705882,https://twitter.com/RadioClydeNews/status/1129053755591340032,fun amp games glasgow city centre print lewiscapaldiface stuck duke wellington statue,RadioClydeNews,0,,
